"CurrentChangeExplanations","BaseYearMil","ThenYearMil","Subsection","Platform","Source","Section"
"RDT&E","$M",NA,"RDT&E","MEADS","2013-12","Missile"
"Revised escalatio indicies (Economic)","N/A","-54.2",NA,"MEADS","2013-12","Missile"
"Stretch-out of procurement buy profile in FY 2020 through FY 2033. (Schedule)","0","93.3",NA,"MEADS","2013-12","Missile"
"Adjustment for current and prior escalation. (Estimating)","4.8","5.8",NA,"MEADS","2013-12","Missile"
"Additional Schedule Variance due to the acceleration of 30 missiles in FY 2014 (procurement changed from 56 to 86 missiles). (Schedule)","-208.2","-255.9",NA,"MEADS","2013-12","Missile"
"Decrease in FY 2013 funding due to Congressional reduction (Estimating)","-3.5","-4.7",NA,"MEADS","2013-12","Missile"
"Adjustment for current and prior escalation. (Support)","0.5","0.8",NA,"MEADS","2013-12","Missile"
"Increase in Other Support due to stretch-out of procurement buy profile (Support)","28.1","51.9",NA,"MEADS","2013-12","Missile"
"Procurement Subtotal","-178.3","-163",NA,"MEADS","2013-12","Missile"
