Contracting.Department.ID,Contracting.Agency.ID,Contracting.Agency.Name,CSIS.Name,Summarized.Agency,SubCustomer,Customer
,,Blank,,ERROR,ERROR,ERROR
10,10,"SENATE, THE",,,All other Customers,Other Agencies
1000,1000,THE JUDICIAL BRANCH,,,All other Customers,Other Agencies
1001,1001,SUPREME COURT OF THE UNITED STATES,,,All other Customers,Other Agencies
1002,1002,U.S. COURTS OF APPEALS-JUDICIAL CIRCUITS (EXCEPT FED CIR),,,All other Customers,Other Agencies
1003,1003,U.S. COURT OF APPEALS FOR THE FEDERAL CIRCUIT,,,All other Customers,Other Agencies
1004,1004,U.S. COURT OF INTERNATIONAL TRADE,,,All other Customers,Other Agencies
1005,1005,U.S. CLAIMS COURT,,,All other Customers,Other Agencies
1012,1012,U.S. DISTRICT AND TERRITORIAL COURTS,,,All other Customers,Other Agencies
1018,1018,JUDICIAL PANEL ON MULTIDISTRICT LITIGATION,,,All other Customers,Other Agencies
1019,1019,TEMPORARY EMERGENCY COURT OF APPEALS,,,All other Customers,Other Agencies
1021,1021,BANKRUPTCY COURTS,,,All other Customers,Other Agencies
1023,1023,FEDERAL PUBLIC DEFENDERS,,,All other Customers,Other Agencies
1025,1025,COURT SECURITY,,,All other Customers,Other Agencies
1027,1027,ADMINISTRATIVE OFFICE OF THE U.S. COURTS,,,All other Customers,Other Agencies
1028,1028,FEDERAL JUDICIAL CENTER,,,All other Customers,Other Agencies
1037,1037,SPECIAL RAIL REORGANIZATION COURT,,,All other Customers,Other Agencies
1001,1050,CHIEF JUSITCE OF THE UNITED STATES,,,Supreme Court,Other Agencies
1001,1051,ASSOCIATE JUSTICES OF THE SUPREME COURT,,,Supreme Court,Other Agencies
1001,1059,"SUPREME COURT, EXCEPT JUSTICES",,,Supreme Court,Other Agencies
1001,1060,JUDICIAL CONFERENCE OF THE UNITED STATES,,,Supreme Court,Other Agencies
1100,1100,EXECUTIVE OFFICE OF THE PRESIDENT,,,Exec Office,Other Agencies
1100,1101,PRESIDENT OF THE UNITED STATES,,,Exec Office,Other Agencies
1100,1102,NATIONAL SECURITY COUNCIL,,,Exec Office,Other Agencies
1100,1103,OFFICE OF MANAGEMENT AND BUDGET,,,Exec Office,Other Agencies
1100,1105,OFFICE OF ADMINISTRATION,,,Exec Office,Other Agencies
1100,1109,OFFICE OF THE UNITED STATES TRADE REPRESENTATIVE,,,Exec Office,Other Agencies
1100,1110,OFFICE OF POLICY DEVELOPMENT,,,Exec Office,Other Agencies
1100,1112,OFFICE OF SCIENCE AND TECHNOLOGY POLICY,,,Exec Office,Other Agencies
1100,1113,COUNCIL OF ECONOMIC ADVISORS,,,Exec Office,Other Agencies
1100,1117,WHITE HOUSE OFFICE,,,Exec Office,Other Agencies
1100,1118,EXECUTIVE RESIDENCE AT THE WHITE HOUSE,,,Exec Office,Other Agencies
1100,1119,COUNCIL ON ENVIRONMENTAL QUALITY,,,Exec Office,Other Agencies
1100,1120,NATIONAL CRITICAL MATERIALS COUNCIL,,,Exec Office,Other Agencies
1100,1121,"DIRECTOR, OMB",,,Exec Office,Other Agencies
1100,1123,WHITE HOUSE CONFERENCE ON INDIAN EDUCATION,,,Exec Office,Other Agencies
1100,1127,OFFICE OF THE NATIONAL DRUG CONTROL POLICY,,,Exec Office,Other Agencies
1100,1129,"OMB, EXCEPT DIRECTOR",,,Exec Office,Other Agencies
1100,1130,NATIONAL SPACE COUNCIL,,,Exec Office,Other Agencies
1100,1141,AFRICAN DEVELOPMENT FOUNDATION,,,Exec Office,Other Agencies
1100,1143,INTER-AMERICAN FOUNDATION,,,Exec Office,Other Agencies
1100,1145,PEACE CORPS,,,Exec Office,Other Agencies
1100,1148,OFFICE OF HOMELAND SECURITY,,,Exec Office,Other Agencies
1100,1150,INTL DEVELOPMENT COOPERATION AGENCY (EXCLUDES OPIC),,,Exec Office,Other Agencies
1100,1151,"OFFICE OF THE DIRECTOR, IDCA",,,Exec Office,Other Agencies
1152,1152,AGENCY FOR INTERNATIONAL DEVELOPMENT,,,Exec Office,Other Agencies
1153,1153,UNITED STATES TRADE AND DEVELOPMENT AGENCY,,,Exec Office,Other Agencies
1100,1160,OFFICE OF THE VICE PRESIDENT OF THE UNITED STATES,,,Exec Office,Other Agencies
1100,1162,DEVELOPMENT COORDINATION COMMITTEE,,,Exec Office,Other Agencies
1100,11CA,WEST AFRICAN RICE DEVELOPMENT ASSOCIATION,,,Exec Office,Other Agencies
1100,11DA,INTERNATIONAL DEVELOPMENT ASSOCIATION,,,Exec Office,Other Agencies
1100,11DB,AFRICAN DEVELOPMENT FUND,,,Exec Office,Other Agencies
1100,11DE,ASIAN DEVELOPMENT BANK,,,Exec Office,Other Agencies
1100,11DF,INTERNATIONAL FINANCE CORPORATION,,,Exec Office,Other Agencies
1100,11DG,INTERNATIONAL FUND FOR AGRICULTURAL DEVELOPMENT,,,Exec Office,Other Agencies
1100,11DH,INTER-AMERICAN DEVELOPMENT BANK,,,Exec Office,Other Agencies
1100,11DM,INTERNATIONAL MONETARY FUND,,,Exec Office,Other Agencies
1100,11DR,INTERNATL BANK FOR RECONSTRUCTION & DEV (WORLD BANK),,,Exec Office,Other Agencies
1100,11EA,CONSULTATIVE GROUP ON INTERNATIONAL AGRICULTURAL RESEARCH,,,Exec Office,Other Agencies
1100,11RF,MULTINATIONAL FORCE AND OBSERVERS,,,Exec Office,Other Agencies
1100,11TE,CONVNTN ON INTERNATL TRD IN ENDANGERED SPECIES OF WILD FAUN,,,Exec Office,Other Agencies
1200,1200,"AGRICULTURE, DEPARTMENT OF",,,Agriculture,Other Agencies
1200,1201,IMMEDIATE OFFICE OF THE SECRETARY OF AGRICULTURE,,,Agriculture,Other Agencies
1200,1203,OFFICE OF THE GENERAL COUNSEL,,,Agriculture,Other Agencies
1200,1204,OFFICE OF INSPECTOR GENERAL,,,Agriculture,Other Agencies
1200,1205,OFFICE OF THE CHIEF FINANCIAL OFFICER,,,Agriculture,Other Agencies
1200,1208,OFFICE OF COMMUNICATIONS,,,Agriculture,Other Agencies
1200,120A,ADMINISTRATION,,,Agriculture,Other Agencies
1200,1215,OFFICE OF OPERATIONS,,,Agriculture,Other Agencies
1200,1217,OFFICE OF FINANCE AND MANAGEMENT,,,Agriculture,Other Agencies
1200,1220,AGRICULTURAL STABILIZATION AND CONSERVATION SERVICE,,,Agriculture,Other Agencies
1200,1222,FEDERAL CROP INSURANCE CORPORATION,,,Agriculture,Other Agencies
1200,1223,FOREIGN AGRICULTURAL SERVICE,,,Agriculture,Other Agencies
1200,1224,OFFICE OF INTERNATIONAL COOPERATION AND DEVELOPMENT,,,Agriculture,Other Agencies
9514,1226,FOREST SERVICE,,,Agriculture,Other Agencies
1200,1227,SOIL CONSERVATION SERVICE,,,Agriculture,Other Agencies
1200,1230,"At one time, Agricultural Research Service",,,Agriculture,Other Agencies
9568,1232,EXTENSION,,,Agriculture,Other Agencies
1200,1236,"At one time, Farmers Home Administration",,,Agriculture,Other Agencies
1200,1237,RURAL ELECTRIFICATION ADMINISTRATION,,,Agriculture,Other Agencies
1200,1241,AGRICULTURAL MARKETING SERVICE,,,Agriculture,Other Agencies
1200,1242,ANIMAL AND PLANT HEALTH INSPECTION SERVICE,,,Agriculture,Other Agencies
1200,1251,FOOD AND NUTRITION SERVICE,,,Agriculture,Other Agencies
1200,1252,FOOD SAFETY AND INSPECTION SERVICE,,,Agriculture,Other Agencies
1200,1259,ECONOMICS MANAGEMENT STAFF,,,Agriculture,Other Agencies
1200,1260,COMMODITY CREDIT CORPORATION,,,Agriculture,Other Agencies
1200,1266,ERROR,,,ERROR,ERROR
1200,12A0,OFFICE OF EXECUTIVE OPERATIONS,,,Agriculture,Other Agencies
1200,12A2,OFFICE OF EXECUTIVE SECRETARIAT,,,Agriculture,Other Agencies
1200,12A4,"USDA, HOMELAND SECURITY",,,Agriculture,Other Agencies
1200,12A5,OFFICE OF THE CHIEF ECONOMIST,,,Agriculture,Other Agencies
1200,12A6,OFFICE OF BUDGET AND PROGRAM ANALYSIS,,,Agriculture,Other Agencies
1200,12A7,OFFICE OF THE CHIEF INFORMATION OFFICER,,,Agriculture,Other Agencies
1200,12A8,OFFICE OF SMALL AND DISADVANTAGED BUSINESS UTILIZATION,,,Agriculture,Other Agencies
1200,12A9,NATIONAL APPEALS DIVISION,,,Agriculture,Other Agencies
1200,12B0,ASSISTANT SECRETARY FOR ADMINISTRATION,,,Agriculture,Other Agencies
1200,12B1,"USDA, OFFICE OF SECURITY SERVICES",,,Agriculture,Other Agencies
1200,12B2,OFFICE OF CIVIL RIGHTS,,,Agriculture,Other Agencies
1200,12B3,OFFICE OF PROCUREMENT AND PROPERTY MANAGEMENT,,,Agriculture,Other Agencies
1200,12B4,OFFICE OF OPERATIONS,,,Agriculture,Other Agencies
1200,12B5,OFFICE OF HUMAN RESOURCES MANAGEMENT,,,Agriculture,Other Agencies
1200,12B6,OFFICE OF ADMINISTRATIVE LAW JUDGE,,,Agriculture,Other Agencies
1200,12B7,OFFICE OF THE JUDICIAL OFFICER,,,Agriculture,Other Agencies
1200,12B8,BOARD OF CONTRACT APPEALS,,,Agriculture,Other Agencies
1200,12B9,"POLICY, ANALYSIS, AND COORDINATION CENTER",,,Agriculture,Other Agencies
1200,12BA,MANAGEMENT SUPPORT STAFF,,,Agriculture,Other Agencies
1200,12BB,OFFICE OF OUTREACH,,,Agriculture,Other Agencies
1200,12BC,OFFICE OF ADMINISTRATIVE SUPPORT,,,Agriculture,Other Agencies
1200,12BD,OFFICE OF ETHICS,,,Agriculture,Other Agencies
1200,12C0,UNDER SECRETARY FOR NATURAL RESOURCES AND ENVIRONMENT,,,Agriculture,Other Agencies
1200,12C2,FOREST SERVICE,,,Agriculture,Other Agencies
1200,12C3,NATURAL RESOURCES CONSERVATION SERVICE,,,Agriculture,Other Agencies
1200,12D0,UNDER SECRETARY FOR FARM AND FOREIGN AGRICULTURAL SERVICES,,,Agriculture,Other Agencies
1200,12D2,FARM SERVICE AGENCY,,,Agriculture,Other Agencies
1200,12D3,FOREIGN AGRICULTURAL SERVICE,,,Agriculture,Other Agencies
1200,12D4,RISK MANAGEMENT AGENCY,,,Agriculture,Other Agencies
1200,12E1,UNDER SECRETARY FOR RURAL DEVELOPMENT,,,Agriculture,Other Agencies
1200,12E2,"AGRICULTURE, DEPARTMENT OF",,,Agriculture,Other Agencies
1200,12E3,"AGRICULTURE, DEPARTMENT OF",,,Agriculture,Other Agencies
1200,12E4,"AGRICULTURE, DEPARTMENT OF",,,Agriculture,Other Agencies
1200,12E5,RURAL BUSINESS COOPERATIVE SERVICE,,,Agriculture,Other Agencies
1200,12E6,ALTERNATIVE AGRICULTURAL RESEARCH AND COMMERCIALIZATION CENTER,,,Agriculture,Other Agencies
1200,12E7,"AGRICULTURE, DEPARTMENT OF",,,Agriculture,Other Agencies
1200,12F0,"UNDER SECRETARY FOR FOOD, NUTRITION, AND CONSUMER SERVICES",,,Agriculture,Other Agencies
1200,12F2,FOOD AND NUTRITION SERVICE,,,Agriculture,Other Agencies
1200,12F3,CENTER FOR NUTRITION POLICY AND PROMOTION,,,Agriculture,Other Agencies
1200,12G0,UNDER SECRETARY FOR FOOD SAFETY,,,Agriculture,Other Agencies
1200,12G2,FOOD SAFETY AND INSPECTION SERVICE,,,Agriculture,Other Agencies
1200,12H0,"UNDER SECRETARY FOR RESEARCH, EDUCATION, AND ECONOMICS",,,Agriculture,Other Agencies
1200,12H2,AGRICULTURAL RESEARCH SERVICE,,,Agriculture,Other Agencies
1200,12H3,"COOPERATIVE STATE RESEARCH, EDUCATION, AND EXTENSION SERVICE",,,Agriculture,Other Agencies
1200,12H4,ECONOMIC RESEARCH SERVICE,,,Agriculture,Other Agencies
1200,12H5,NATIONAL AGRICULTURAL STATISTICS SERVICE,,,Agriculture,Other Agencies
1200,12J0,ASSISTANT SECRETARY FOR CONGRESSIONAL RELATIONS,,,Agriculture,Other Agencies
1200,12J2,OFFICE OF CONGRESSIONAL AND INTERGOVERNMENTAL RELATIONS,,,Agriculture,Other Agencies
1200,12K0,ASSISTANT SECRETARY FOR MARKETING AND REGULATORY PROGRAMS,,,Agriculture,Other Agencies
1200,12K2,AGRICULTURAL MARKETING SERVICE,,,Agriculture,Other Agencies
1200,12K3,ANIMAL AND PLANT HEALTH INSPECTION SERVICE,,,Agriculture,Other Agencies
1200,12K4,"GRAIN INSPECTION, PACKERS AND STOCKYARDS ADMINISTRATION",,,Agriculture,Other Agencies
1300,1300,"COMMERCE, DEPARTMENT OF",,,Commerce,Other Agencies
1300,1301,OFFICE OF THE SECRETARY,,,Commerce,Other Agencies
1300,1304,OFFICE OF THE INSPECTOR GENERAL,,,Commerce,Other Agencies
1300,131E,ECONOMIC AFFAIRS,,,Commerce,Other Agencies
1300,1321,BUREAU OF ECONOMIC ANALYSIS,,,Commerce,Other Agencies
1300,1323,BUREAU OF THE CENSUS,,,Commerce,Other Agencies
1300,1325,ECONOMIC DEVELOPMENT ADMINISTRATION,,,Commerce,Other Agencies
1300,1330,NATIONAL OCEANIC AND ATMOSPHERIC ADMINISTRATION,,,Commerce,Other Agencies
1300,1335,NATIONAL TELECOMMUNICATIONS AND INFORMATION ADMINISTRATION,,,Commerce,Other Agencies
1300,1341,NATIONAL INSTITUTE OF STANDARDS AND TECHNOLOGY,,,Commerce,Other Agencies
1300,1342,NATIONAL TECHNICAL INFORMATION SERVICE,,,Commerce,Other Agencies
1300,1344,PATENT AND TRADEMARK OFFICE,,,Commerce,Other Agencies
1300,1350,INTERNATIONAL TRADE ADMINISTRATION,,,Commerce,Other Agencies
1300,1351,U.S. EXPORT ADMINISTRATION,,,Commerce,Other Agencies
1300,1352,MINORITY BUSINESS DEVELOPMENT AGENCY,,,Commerce,Other Agencies
1300,1355,U.S. TRAVEL AND TOURISM ADMINISTRATION,,,Commerce,Other Agencies
1300,1359,TECHNOLOGY ADMINSTRATION,,,Commerce,Other Agencies
1400,1400,"INTERIOR, DEPARTMENT OF THE",,,Interior,Other Agencies
1400,1402,OFFICE OF THE UNDER SECRETARY OF THE INTERIOR,,,Interior,Other Agencies
1400,1403,OFFICE OF THE SOLICITOR,,,Interior,Other Agencies
1400,1404,OFFICE OF THE INSPECTOR GENERAL,,,Interior,Other Agencies
1400,1406,"OFFICE OF POLICY, BUDGET AND ADMINISTRATION",,,Interior,Other Agencies
1400,1407,OFFICE OF CONGRESSIONAL AND LEGISLATIVE AFFAIRS,,,Interior,Other Agencies
1400,1408,OFFICE OF PUBLIC AFFAIRS,,,Interior,Other Agencies
1400,1409,OFFICE OF TERRITORIAL AND INTERNATIONAL AFFAIRS,,,Interior,Other Agencies
1400,140S,OFFICE OF THE SECRETARY OF THE INTERIOR,,,Interior,Other Agencies
1400,1410,OFFICE OF YOUTH PROGRAMS,,,Interior,Other Agencies
1400,1411,OFFICE FOR EQUAL OPPORTUNITY,,,Interior,Other Agencies
1400,1413,OFFICE OF HEARINGS AND APPEALS,,,Interior,Other Agencies
1400,1414,EXECUTIVE SECRETARIAT,,,Interior,Other Agencies
1400,1415,OFFICE OF THE SPECIAL TRUSTEE FOR AMERICAN INDIANS,,,Interior,Other Agencies
1400,1416,INDIAN ARTS AND CRAFTS BOARD,,,Interior,Other Agencies
1400,1417,OFFICE OF HISOTRICALLY BLACK COLLEGE AND UNIVERSITY PROGRAMS,,,Interior,Other Agencies
1400,1418,OFFICE OF SMALL AND DISADVANTAGED BUSINESS UTILIZATION,,,Interior,Other Agencies
1400,1422,BUREAU OF LAND MANAGEMENT,,,Interior,Other Agencies
1400,1425,BUREAU OF RECLAMATION,,,Interior,Other Agencies
1400,142F,FISH AND WILDLIFE AND PARKS,,,Interior,Other Agencies
1400,142L,LAND AND MINERALS MANAGEMENT,,,Interior,Other Agencies
1400,142N,INDIAN AFFAIRS,,,Interior,Other Agencies
1400,142W,WATER AND SCIENCE,,,Interior,Other Agencies
1400,1432,BUREAU OF MINES,,,Interior,Other Agencies
1400,1434,GEOLOGICAL SURVEY,,,Interior,Other Agencies
1400,1435,MINERALS MANAGEMENT SERVICE,,,Interior,Other Agencies
1400,1436,BUREAU OF SAFETY AND ENVIRONMENTAL ENFORCEMENT,"INTERIOR, DEPARTMENT OF THE",,Interior,Other Agencies
1400,1438,"OFFICE OF SURFACE MINING, RECLAMATION AND ENFORCEMENT",,,Interior,Other Agencies
1400,1443,NATIONAL PARK SERVICE,,,Interior,Other Agencies
1400,1445,NATIONAL BIOLOGICAL SURVEY,,,Interior,Other Agencies
1400,1448,U.S. FISH AND WILDLIFE SERVICE,,,Interior,Other Agencies
1400,1450,BUREAU OF INDIAN AFFAIRS,,,Interior,Other Agencies
1400,1460,BOARD ON GEOGRAPHIC NAMES,,,Interior,Other Agencies
1400,1461,MIGRATORY BIRD CONSERVATION COMMISSION,,,Interior,Other Agencies
1400,1462,NORTHERN MARIANA ISLANDS COMMISSION OF FEDERAL LAWS,,,Interior,Other Agencies
1400,1464,IL AND MI CANAL NATIONAL HERITAGE CORRIDOR COMMISSION,,,Interior,Other Agencies
1400,1465,METROPOLITAN RIVER CORRIDORS STUDY COMMITTEE,,,Interior,Other Agencies
1400,1469,NATIONAL INDIAN GAMING COMMISSION,,,Interior,Other Agencies
1500,1500,"JUSTICE, DEPARTMENT OF",,,Justice,Other Agencies
1500,1501,"OFFICES, BOARDS AND DIVISIONS",,,Justice,Other Agencies
1500,1504,OFFICE OF THE INSPECTOR GENERAL,,,Justice,Other Agencies
1500,1524,DRUG ENFORCEMENT ADMINISTRATION,,,Justice,Other Agencies
1500,1526,EXEC OFF FOR U.S. ATTORNEYS AND THE OFFICES OF U.S. ATTORNEYS,,,Justice,Other Agencies
1500,1528,Formerly Immigration and Naturalization Service,,,Justice,Other Agencies
1500,1530,EXECUTIVE OFFICE FOR IMMIGRATION REVIEW,,,Justice,Other Agencies
1500,1535,COMMUNITY RELATIONS SERVICE,,,Justice,Other Agencies
1500,1540,FEDERAL PRISON SYSTEM,,,Justice,Other Agencies
1500,1544,U.S. MARSHALS SERVICE,,,Justice,Other Agencies
1500,1549,FEDERAL BUREAU OF INVESTIGATION,,,Justice,Other Agencies
1500,1550,OFFICE OF JUSTICE PROGRAMS,,,Justice,Other Agencies
1500,1555,U.S. TRUSTEE SYSTEM,,,Justice,Other Agencies
1500,1560,ATF ACQUISITION AND PROPERTY MGMT DIV,,,Justice,Other Agencies
1600,1600,"LABOR, DEPARTMENT OF",,,Labor,Other Agencies
1600,1601,IMMEDIATE OFFICE OF THE SECRETARY OF LABOR,,,Labor,Other Agencies
1600,1603,OFFICE OF THE SOLICITOR,,,Labor,Other Agencies
1600,1604,OFFICE OF INSPECTOR GENERAL,,,Labor,Other Agencies
1600,1605,OFFICE OF THE ASSISTANT SECRETARY FOR ADMIN AND MANAGEMENT,,,Labor,Other Agencies
1600,1606,OFFICE OF THE ASSISTANT SECRETARY FOR POLICY,,,Labor,Other Agencies
1600,1607,OFF OF THE DEPUTY UNDER SECRETARY FOR CONGRESSIONAL AFFAIRS,,,Labor,Other Agencies
1600,1608,OFFICE OF INFORMATION AND PUBLIC AFFAIRS,,,Labor,Other Agencies
1600,1609,BUREAU OF INTERNATIONAL LABOR AFFAIRS,,,Labor,Other Agencies
1600,160S,OFFICE OF THE SECRETARY OF LABOR,,,Labor,Other Agencies
1600,160U,OFFICE OF THE UNDER SECRETARY OF LABOR,,,Labor,Other Agencies
1600,1610,WAGE APPEALS BOARD,,,Labor,Other Agencies
1600,1613,OFFICE OF ADMINISTRATIVE LAW JUDGES,,,Labor,Other Agencies
1600,1614,"OFF OF THE DEPUTY UNDER SEC FOR PUB AND INTERGOV""TL AFFAIRS",,,Labor,Other Agencies
1600,1615,BENEFITS REVIEW BOARD,,,Labor,Other Agencies
1600,1616,EMPLOYEES COMPENSATION APPEALS BOARD,,,Labor,Other Agencies
1600,1617,ADMINISTRATIVE REVIEW BOARD,,,Labor,Other Agencies
1600,1618,OFFICE OF SMALL AND DISADVANTAGED BUSINESS UTILIZATION,,,Labor,Other Agencies
1600,1621,PENSION AND WELFARE BENEFITS ADMINISTRATION,,,Labor,Other Agencies
1600,1622,OFFICE OF THE CHIEF FINANCIAL OFFICER,,,Labor,Other Agencies
1600,1625,BUREAU OF LABOR STATISTICS,,,Labor,Other Agencies
1600,1630,EMPLOYMENT AND TRAINING ADMINISTRATION,,,Labor,Other Agencies
1600,1631,OFFICE OF JOB CORPS,,,Labor,Other Agencies
1600,1635,EMPLOYMENT STANDARDS ADMINISTRATION,,,Labor,Other Agencies
1600,1642,OFF OF THE DEPUTY UNDER SEC FOR LABOR-MGMT RELATIONS & COOP,,,Labor,Other Agencies
1600,1643,OFFICE OF LABOR-MANAGEMENT STANDARDS,,,Labor,Other Agencies
1600,1645,MINE SAFETY AND HEALTH ADMINISTRATION,,,Labor,Other Agencies
1600,1650,OCCUPATIONAL SAFETY AND HEALTH ADMINISTRATION,,,Labor,Other Agencies
1600,1653,VETERANS EMPLOYMENT AND TRAINING SERVICES,,,Labor,Other Agencies
1600,1655,WOMEN'S BUREAU,,,Labor,Other Agencies
1600,1663,NATIONAL COMMISSION FOR EMPLOYMENT POLICY,,,Labor,Other Agencies
1665,1665,PENSION BENEFIT GUARANTY CORPORATION,,,Labor,Other Agencies
1600,1667,PRESIDENT'S COMMITTEE ON EMPLOYMENT OF THE HANDICAPPED,,,Labor,Other Agencies
1600,1669,NATIONAL OCCUPATIONAL INFORMATION COORDINATING COMMITTEE,,,Labor,Other Agencies
9700,1700,DEPT OF THE NAVY,DEPT OF THE NAVY,DEPT OF THE NAVY,Navy,Defense
1800,1800,POSTAL SERVICE,,,All other Customers,Other Agencies
9700,1801,SOUTHERN DIV,,,ERROR,ERROR
9700,1802,ACCTG DISB STA NR 660700,,,ERROR,ERROR
9700,1803,DEFENSE FINANCE AND ACCOUNTING SERV,,,ERROR,ERROR
9700,1804,ACCTG DISB STA NR 525700,,,ERROR,ERROR
9700,1805,ACCTG DISB STA NR 525700,,,ERROR,ERROR
9700,1806,DFAS COLUMBUS CENTER,,,ERROR,ERROR
9700,1807,ACCTG DISB STA NR 525700,,,ERROR,ERROR
9700,1808,DEFENSE FINANCE AND ACCOUNTING SERV,,,ERROR,ERROR
9700,1809,AMERICAN RED CROSS,,,ERROR,ERROR
,1810,DEPARTMENT OF JUSTICE,,,ERROR,ERROR
9700,1812,ACCTG DISB STA NR 525700,,,ERROR,ERROR
9700,1813,DEFENSE FINANCE AND ACCOUNTING SERV,,,ERROR,ERROR
9700,1814,STARS FUNDING ONLY,,,ERROR,ERROR
1900,1900,"STATE, DEPARTMENT OF",,,State,State and IAP
1900,1901,IMMEDIATE OFFICE OF THE SECRETARY OF STATE,,,State,State and IAP
1900,1902,OFFICE OF THE DEPUTY SECRETARY OF STATE,,,State,State and IAP
1900,1903,OFFICE OF THE LEGAL ADVISER,,,State,State and IAP
1900,1904,OFFICE OF THE INSPECTOR GENERAL,,,State,State and IAP
1900,1905,OFFICE OF THE UNDER SECRETARY FOR MANAGEMENT,,,State,State and IAP
1900,1906,POLICY PLANNING COUNCIL,,,State,State and IAP
1900,1907,BUREAU OF LEGISLATIVE AND INTERGOVERNMENTAL AFFAIRS,,,State,State and IAP
1900,1908,OFFICE OF POLICY AND PROGRAM REVIEW,,,State,State and IAP
1900,1910,OFFICE OF PROTOCOL,,,State,State and IAP
1900,1913,OFFICE OF THE UNDER SECRETARY FOR POLITICAL AFFAIRS,,,State,State and IAP
1900,1914,OFFICE OF THE UNDER SEC FOR ECON AND AGRICULTURAL AFFAIRS,,,State,State and IAP
1900,1915,OFF OF THE UNDER SEC FOR SECURITY ASST. SCIENCE & TECH,,,State,State and IAP
1900,1916,COUNSELOR OF THE DEPARTMENT OF STATE,,,State,State and IAP
1900,1917,OFFICE OF EXECUTIVE SECRETARIAT,,,State,State and IAP
1900,1921,BUREAU OF AFRICAN AFFAIRS,,,State,State and IAP
1900,1923,BUREAU OF EAST ASIAN AND PACIFIC AFFAIRS,,,State,State and IAP
1900,1925,BUREAU OF EUROPEAN AND CANADIAN AFFAIRS,,,State,State and IAP
1900,1927,BUREAU OF INTER-AMERICAN AFFAIRS,,,State,State and IAP
1900,1929,BUREAU OF NEAR EASTERN AND SOUTH ASIAN AFFAIRS,,,State,State and IAP
1900,1930,BUREAU OF CONSULAR AFFAIRS,,,State,State and IAP
1900,1933,BUREAU OF ECONOMIC AND BUSINESS AFFAIRS,,,State,State and IAP
1900,1936,BUREAU OF HUMAN RIGHTS HUMANITARIAN AFFAIRS,,,State,State and IAP
1900,1937,BUREAU OF ADMINISTRATION,,,State,State and IAP
1900,1938,BUREAU OF DIPLOMATIC SECURITY,,,State,State and IAP
1900,1939,BUREAU OF INTELLIGENCE AND RESEARCH,,,State,State and IAP
1900,1942,BUREAU OF INTERNATIONAL NARCOTICS MATTERS,,,State,State and IAP
1900,1945,BUREAU OF INTERNATIONAL ORGANIZATION AFFAIRS,,,State,State and IAP
1900,1948,BUREAU OF OCEANS & INTL ENVIRONMENTAL & SCIENTIFIC AFFAIRS,,,State,State and IAP
1900,1950,BUREAU OF POLITICO-MILITARY AFFAIRS,,,State,State and IAP
1900,1952,BUREAU OF PUBLIC AFFAIRS,,,State,State and IAP
1900,1954,BUREAU OF REFUGEE PROGRAMS,,,State,State and IAP
1900,1958,OFFICE OF U.S. AMBASSADOR TO THE UNITED NATIONS,,,State,State and IAP
1900,1961,U.S. NATIONAL COMMISSION FOR UNESCO,,,State,State and IAP
9700,1963,DFAS ROME,,,ERROR,ERROR
9700,1965,DFAS INDIANAPOLIS CENTER,,,ERROR,ERROR
9700,1966,ARMY CORPS OF ENGINEERS CIVIL WORKS,,,ERROR,ERROR
9700,1967,DFAS LAWTON,,,ERROR,ERROR
9700,1968,DEPARTMENT OF THE ARMY,,,ERROR,ERROR
9700,1969,DFAS INDIANAPOLIS CENTER,,,ERROR,ERROR
9700,1979,ACCTG DISB STA NR 525700,,,ERROR,ERROR
9700,1980,DFAS SAN ANTONIO,,,ERROR,ERROR
9700,1983,DFAS INDIANAPOLIS CENTER,,,ERROR,ERROR
9700,1988,DFAS LAWTON,,,ERROR,ERROR
9700,1990,ACCTG DISB STA NR 660700,,,ERROR,ERROR
1900,1991,AMERICAN INSTITUTE IN TAIWAN,,,ERROR,ERROR
1900,1993,ASIS FOUNDATION,,,ERROR,ERROR
9700,1994,DFAS INDIANAPOLIS CENTER,,,ERROR,ERROR
9700,1995,ACCTG DISB STA NR 525700,,,ERROR,ERROR
9700,1996,DFAS INDIANAPOLIS CENTER,,,ERROR,ERROR
9700,1997,XR HQ USMEPCOM,,,ERROR,ERROR
9700,1998,DFAS-SL-EC,,,ERROR,ERROR
1900,19AA,INTER-AMERICAN INSTITUTE FOR COOPERATION ON AGRICULTURE,,,State,State and IAP
1900,19AG,PAN-AMERICAN INSTITUTE OF GEOGRAPHY AND HISTORY,,,State,State and IAP
1900,19AH,PAN-AMERICAN HEALTH ORGANIZATION,,,State,State and IAP
1900,19AN,INTER-AMERICAN INDIAN INSTITUTE,,,State,State and IAP
1900,19AR,PAN-AMERICAN RAILWAY CONGRESS ASSOCIATION,,,State,State and IAP
1900,19AS,ORGANIZATION OF AMERICAN STATES,,,State,State and IAP
1900,19BC,INTERNATIONAL BOUNDARY COMMISSION: U.S. AND CANADA,,,State,State and IAP
1900,19BJ,INTERNATIONAL JOINT COMMISSION: U.S. AND CANADA,,,State,State and IAP
19BM,19BM,INTERNATIONAL BOUNDARY AND WATER COMMISSION: U.S.-MEXICO,,,State,State and IAP
1900,19CB,INTERNATIONAL NATURAL RUBBER ORGANIZATION,,,State,State and IAP
1900,19CC,INTERNATIONAL COTTON ADVISORY COMMITTEE,,,State,State and IAP
1900,19CF,INTERNATIONAL COFFEE ORGANIZATION,,,State,State and IAP
1900,19CJ,INTERNATIONAL JUTE ORGANIZATION,,,State,State and IAP
1900,19CL,INTERNATIONAL LEAD AND ZINC STUDY GROUP,,,State,State and IAP
1900,19CR,INTERNATIONAL RUBBER STUDY GROUP,,,State,State and IAP
1900,19CS,INTERNATIONAL SUGAR ORGANIZATION,,,State,State and IAP
1900,19CV,INTERNATIONAL OFFICE OF VINE AND WINE,,,State,State and IAP
1900,19CW,INTERNATIONAL WHEAT COUNCIL,,,State,State and IAP
1900,19EC,INTERNATIONAL AGENCY FOR RESEARCH ON CANCER,,,State,State and IAP
1900,19EM,INTERNATIONAL BUREAU OF WEIGHTS AND MEASURES,,,State,State and IAP
1900,19EP,INTERNATL CENTER FOR THE STUDY OF THE PRESERVATION & RESTORA,,,State,State and IAP
1900,19ES,INTERNATIONAL SEED TESTING ASSOCIATION,,,State,State and IAP
1900,19EV,INTERNATL UNION FOR PROTECTION OF NEW VARIETIES OF PLANTS,,,State,State and IAP
1900,19EZ,INTERNATIONAL OFFICE OF EPIZOOTICS,,,State,State and IAP
1900,19FA,NORTH ATLANTIC SALMON CONSERVATION ORGANIZATION,,,State,State and IAP
1900,19FE,INTERNATIONAL COUNCIL FOR THE EXPLORATION OF THE SEA,,,State,State and IAP
1900,19FF,NORTH PACIFIC FUR SEAL COMMISSION,,,State,State and IAP
1900,19FG,GREAT LAKES FISHERY COMMISSION,,,State,State and IAP
1900,19FH,INTERNATIONAL PACIFIC HALIBUT COMMISSION,,,State,State and IAP
1900,19FL,INTERNATL COMM FOR THE CONSERVATION OF ATLANTIC TUNAS,,,State,State and IAP
1900,19FN,NORTHWEST ATLANTIC FISHERIES ORGANIZATION,,,State,State and IAP
1900,19FP,INTERNATIONAL NORTH PACIFIC FISHERIES COMMISSION,,,State,State and IAP
1900,19FR,COMM FOR THE CONSERVATION OF ANTARCTIC MARINE LIVING RSRCS,,,State,State and IAP
1900,19FT,INTER-AMERICAN TROPICAL TUNA COMMISSION,,,State,State and IAP
1900,19FW,INTERNATIONAL WHALING COMMISSION,,,State,State and IAP
1900,19LA,INTERNATIONAL BUREAU OF THE PERMANENT COURT OF ARBITRATION,,,State,State and IAP
1900,19LH,HAGUE CONFERENCE ON PRIVATE INTERNATIONAL LAW,,,State,State and IAP
1900,19LM,INTERNATIONAL ORGANIZATION FOR LEGAL METROLOGY,,,State,State and IAP
1900,19LU,INTERNATIONAL INSTITUTE FOR THE UNIFICATION OF PRIVATE LAW,,,State,State and IAP
1900,19MC,U.N. MEMORIAL CEMETARY COMMISSION,,,State,State and IAP
1900,19ME,INTERGOVERNMENTAL COMMITTEE FOR MIGRATION,,,State,State and IAP
1900,19MR,INTERNATIONAL COMMITTEE OF THE RED CROSS,,,State,State and IAP
1900,19NH,INTERNATIONAL HYDROGRAPHIC ORGANIZATION,,,State,State and IAP
1900,19NL,INTERNATL AGREEMENT REGARDING MAINTENANCE OF CERTAIN LIGHTS,,,State,State and IAP
1900,19PC,CANADA-UNITED STATES INTERPARLIAMENTARY GROUP,,,State,State and IAP
1900,19PM,MEXICO-UNITED STATES INTERPARLIAMENTARY GROUP,,,State,State and IAP
1900,19PU,INTERPARLIAMENTARY UNION,,,State,State and IAP
1900,19RA,NORTH ATLANTIC ASSEMBLY,,,State,State and IAP
1900,19RC,COLUMBO PLAN COUNCIL FOR TECHNICAL COOPERATION,,,State,State and IAP
1900,19RE,ORGANIZATION FOR ECONOMIC COOPERATION AND DEVELOPMENT,,,State,State and IAP
1900,19RN,NORTH ATLANTIC TREATY ORGANIZATION,,,State,State and IAP
1900,19RP,SOUTH PACIFIC COMMISSION,,,State,State and IAP
1900,19TC,CUSTOMS COOPERATION COUNCIL,,,State,State and IAP
1900,19TP,INTERNATIONAL BUREAU FOR THE PUBLICATION OF CUSTOMS TARIFFS,,,State,State and IAP
1900,19TT,GENERAL AGREEMENT ON TARIFFS AND TRADE,,,State,State and IAP
1900,19TW,WORLD TOURISM ORGANIZATION,,,State,State and IAP
1900,19TX,BUREAU OF INTERNATIONAL EXPOSITIONS,,,State,State and IAP
1900,19UA,INTERNATIONAL CIVIL AVIATION ORGANIZATION,,,State,State and IAP
