Contracting.Department.ID,Contracting.Agency.ID,Contracting.Agency.Name,CSIS.Name,Summarized.Agency,SubCustomer,Customer
7000,7000,"HOMELAND SECURITY, DEPARTMENT OF",,,Other DHS,DHS
7000,7001,"OFFICE OF THE SECRETARY, DEPARTMENT OF HOMELAND SECURITY",,,OSEC,DHS
7000,7002,IMMEDIATE OFFICE OF THE SECRETARY,,,Other DHS,DHS
7000,7003,BUREAU OF CITIZENSHIP AND IMMIGRATION SERVICES,,,Other DHS,DHS
7000,7004,OFFICE OF THE INSPECTOR GENERAL,,,Other DHS,DHS
7000,7008,U.S. COAST GUARD,,,COAST GUARD,DHS
7000,7009,U.S. SECRET SERVICE,,,Other DHS,DHS
7000,7010,OFFICE OF THE UNDER SECRETARY FOR BORDER AND TRANSPORTATION SECURITY,,,Other DHS,DHS
7000,7011,IMMEDIATE OFF OF THE UNDER SECRETARY FOR BORDER AND TRANSPORTATION SECURITY,,,Other DHS,DHS
7000,7012,BUREAU OF IMMIGRATION AND CUSTOMS ENFORCEMENT,,,ICE,DHS
7000,7013,TRANSPORTATION SECURITY ADMINISTRATION,,,TSA,DHS
7000,7014,BUREAU OF CUSTOMS AND BORDER PROTECTION,,,CBP,DHS
7000,7015,FEDERAL LAW ENFORCEMENT TRAINING CENTER,,,Other DHS,DHS
7000,7020,OFFICE OF THE UNDER SECRETARY FOR EMERGENCY PREPAREDNESS AND RESPONSE,,,Other DHS,DHS
7000,7021,IMMEDIATE OFF OF THE UNDER SECRETARY FOR EMERGENCY PREPAREDNESS AND RESPONSE,,,Other DHS,DHS
7000,7022,FEDERAL EMERGENCY MANAGEMENT AGENCY,,,FEMA,DHS
7000,7030,OFF OF THE UNDER SECRETARY FOR INFO ANALYSIS AND INFRASTRUCTURE PROTECTION,,,Other DHS,DHS
7000,7031,IMMED OFF OF UNDER SECRETARY FOR INFO ANALYSIS AND INFRASTRUCTURE PROTECTION,,,Other DHS,DHS
7000,7032,OFFICE FOR INFORMATION ANALYSIS,,,Other DHS,DHS
7000,7033,OFFICE FOR INFRASTRUCTURE PROTECTION,,,Other DHS,DHS
7000,7040,OFFICE OF THE UNDER SECRETARY FOR SCIENCE AND TECHNOLOGY,,,Other DHS,DHS
7000,7041,IMMEDIATE OFFICE OF THE UNDER SECRETARY FOR SCIENCE AND TECHNOLOGY,,,Other DHS,DHS
7000,7050,OFFICE OF THE UNDER SECRETARY FOR MANAGEMENT,,,Other DHS,DHS
7000,7051,IMMEDIATE OFFICE OF THE UNDER SECRETARY FOR MANAGEMENT,,,Other DHS,DHS
7100,7100,OVERSEAS PRIVATE INVESTMENT CORPORATION,,,All other Customers,Other Agencies
7200,7200,AGENCY FOR INTERNATIONAL DEVELOPMENT,,,USAID,State and IAP
7300,7300,SMALL BUSINESS ADMINISTRATION,,,SMALL BUSINESS ADMINISTRATION,Other Agencies
7400,7400,AMERICAN BATTLE MONUMENTS COMMISSION,,,All other Customers,Other Agencies
7500,7500,"HEALTH AND HUMAN SERVICES, DEPARTMENT OF",,,HHS,HHS
7500,7501,IMMED OFFICE OF THE SECRETARY OF HEALTH AND HUMAN SERVICES,,,HHS,HHS
7500,7502,OFFICE OF THE UNDER SECRETARY OF HEALTH AND HUMAN SERVICES,,,HHS,HHS
7500,7503,OFFICE OF THE GENERAL COUNSEL,,,HHS,HHS
7500,7504,OFFICE OF THE INSPECTOR GENERAL,,,HHS,HHS
7500,7505,OFFICE OF ASSISTANT SECRETARY FOR MANAGEMENT AND BUDGET,,,HHS,HHS
7500,7506,OFFICE OF ASSISTANT SECRETARY FOR PLANNING AND EVALUATION,,,HHS,HHS
7500,7507,OFFICE OF ASSISTANT SECRETARY FOR LEGISLATION,,,HHS,HHS
7500,7508,OFFICE OF ASSISTANT SECRETARY FOR PUBLIC AFFAIRS,,,HHS,HHS
7500,750S,OFFICE OF THE SECRETARY OF HEALTH AND HUMAN SERVICES,,,HHS,HHS
7500,7510,U.S. OFFICE OF CONSUMER AFFAIRS,,,HHS,HHS
7500,7511,OFFICE FOR CIVIL RIGHTS,,,HHS,HHS
7500,7515,OFFICE OF PUBLIC HEALTH AND SCIENCE,,,HHS,HHS
7500,7516,OFFICE OF ASSISTANT SECRETARY FOR PERSONNEL,,,HHS,HHS
7500,7520,PUBLIC HEALTH SERVICE,,,HHS,HHS
7500,7521,OFFICE OF ASSISTANT SECRETARY FOR HEALTH,,,HHS,HHS
7500,7522,"ALCOHOL, DRUG ABUSE AND MENTAL HEALTH ADMINISTRATION",,,HHS,HHS
7500,7523,CENTERS FOR DISEASE CONTROL,,,HHS,HHS
7500,7524,FOOD AND DRUG ADMINISTRATION,,,HHS,HHS
7500,7525,AGENCY FOR TOXIC SUBSTANCES AND DISEASE REGISTRY,,,HHS,HHS
7500,7526,HEALTH RESOURCES AND SERVICES ADMINISTRATION,,,HHS,HHS
7500,7527,INDIAN HEALTH SERVICE,,,HHS,HHS
7500,7528,AGENCY FOR HEALTH CARE POLICY AND RESEARCH,,,HHS,HHS
7500,7529,NATIONAL INSTITUTES OF HEALTH,,,HHS,HHS
7500,7530,CENTERS FOR MEDICARE AND MEDICAID SERVICES,,,HHS,HHS
7500,7537,FAMILY SUPPORT ADMINISTRATION,,,HHS,HHS
7500,7540,OFFICE OF HUMAN DEVELOPMENT SERVICES,,,HHS,HHS
7500,7545,ADMINISTRATION ON AGING,,,HHS,HHS
7500,7550,SOCIAL SECURITY ADMINISTRATION,,,HHS,HHS
7500,7555,OFFICE OF ASST SECRETARY FOR HEALTH EXCEPT NATIONAL CENTERS,,,HHS,HHS
7500,7558,NAT CENTER FOR HEALTH SERV RESEARCH AND HEALTH CARE TECH ASSES,,,HHS,HHS
7500,7559,NATIONAL CENTER FOR HEALTH STATISTICS,,,HHS,HHS
7500,7590,ADMINISTRATION FOR CHILDREN AND FAMILIES,,,HHS,HHS
7500,7593,GORGAS MEMORIAL INST OF TROPICAL AND PREVENTATIVE MEDICINE,,,HHS,HHS
7608,7608,CHRISTOPHER COLUMBUS QUINCENTENARY JUBILEE COMMISSION,,,All other Customers,Other Agencies
7609,7609,COMMISSION ON THE BICENTENNIAL OF THE U.S. CONSTITUTION,,,All other Customers,Other Agencies
7611,7611,DWIGHT DAVID EISENHOWER CENTENNIAL COMMISSION,,,All other Customers,Other Agencies
7615,7615,"MARTIN LUTHER KING, JR. FEDERAL HOLIDAY COMMISSION",,,All other Customers,Other Agencies
1200,7777,FEDERAL CROP INSURANCE CORPORATION,,,All other Customers,Other Agencies
7800,7800,FARM CREDIT ADMINISTRATION,,,All other Customers,Other Agencies
7800,7881,BANKS FOR COOPERATIVES (13),,,All other Customers,Other Agencies
7800,7883,FEDERAL INTERMEDIATE CREDIT BANKS (12),,,All other Customers,Other Agencies
7800,7885,FEDERAL LAND BANKS (12),,,All other Customers,Other Agencies
7800,7887,FEDERAL LAND BANK ASSOCIATIONS,,,All other Customers,Other Agencies
7800,7888,FARM CREDIT SYSTEMS INSURANCE CORPORATION,,,All other Customers,Other Agencies
800,800,CONGRESSIONAL BUDGET OFFICE,,,All other Customers,Other Agencies
8000,8000,NATIONAL AERONAUTICS AND SPACE ADMINISTRATION,,,NASA,NASA
8000,8001,"HEADQUARTERS, NASA",,,NASA,NASA
8000,8020,AMES RESEARCH CENTER,,,NASA,NASA
8000,8022,,,,NASA,NASA
8000,8026,GODDARD SPACE FLIGHT CENTER,,,NASA,NASA
8000,8029,"NASA RESIDENT OFFICE, JET PROPULSION LABORATORY",,,NASA,NASA
8000,8032,LYNDON B. JOHNSON SPACE CENTER,,,NASA,NASA
8000,8035,JOHN F. KENNEDY SPACE CENTER,,,NASA,NASA
8000,8038,LANGLEY RESEARCH CENTER,,,NASA,NASA
8000,8041,LEWIS RESEARCH CENTER,,,NASA,NASA
8000,8044,GEORGE C. MARSHALL SPACE FLIGHT CENTER,,,NASA,NASA
8000,8047,NATIONAL SPACE TECHNOLOGY LABORATORIES,,,NASA,NASA
8200,8200,FEDERAL HOME LOAN BANK BOARD,,,All other Customers,Other Agencies
8200,8291,NEIGHBORHOOD REINVESTMENT CORPORATION,,,All other Customers,Other Agencies
8300,8300,EXPORT-IMPORT BANK OF THE U.S.,,,All other Customers,Other Agencies
AFRH,8400,UNITED STATES SOLDIERS AND AIRMENS HOME,,,All other Customers,Other Agencies
84AF,84AF,ARMED FORCES RETIREMENT HOME,,,All other Customers,Other Agencies
8600,8600,"HOUSING AND URBAN DEVELOPMENT, DEPARTMENT OF",,,HUD,Other Agencies
8600,8601,OFFICE OF THE SECRETARY OF HOUSING AND URBAN DEVELOPMENT,,,HUD,Other Agencies
8600,8602,DEPUTY SECRETARY OF HOUSING AND URBAN DEVELOPMENT,,,HUD,Other Agencies
8600,8603,OFFICE OF GENERAL COUNSEL,,,HUD,Other Agencies
8600,8604,OFFICE OF INSPECTOR GENERAL,,,HUD,Other Agencies
8600,8605,ASSISTANT SECRETARY FOR ADMINISTRATION,,,HUD,Other Agencies
8600,8607,ASSISTANT SECRETARY FOR CONGRESSIONAL AND INTERGOVERNMENTAL RELATIONS,,,HUD,Other Agencies
8600,8608,ASSISTANT SECRETARY FOR PUBLIC AFFAIRS,,,HUD,Other Agencies
8600,8611,ASSISTANT SECRETARY FOR FAIR HOUSING AND EQUAL OPPORTUNITY,,,HUD,Other Agencies
8600,8615,ADMINISTRATIVE LAW JUDGES,,,HUD,Other Agencies
8600,8620,ASSISTANT SECRETARY FOR COMMUNITY PLANNING AND DEVELOPMENT,,,HUD,Other Agencies
8600,8625,GOVERNMENT NATIONAL MORTGAGE ASSOCIATION,,,HUD,Other Agencies
8600,8630,ASST SECRETARY FOR HOUSING--FEDERAL HOUSING COMMISSIONER,,,HUD,Other Agencies
8600,8635,ASSISTANT SECRETARY FOR PUBLIC AND INDIAN HOUSING,,,HUD,Other Agencies
8600,8645,ASSISTANT SECRETARY FOR POLICY DEVELOPMENT AND RESEARCH,,,HUD,Other Agencies
8600,8650,SOLAR ENERGY AND ENERGY CONSERVATION BANK,,,HUD,Other Agencies
8600,8652,OFFICE OF THE CHIEF INFORMATION OFFICER,,,HUD,Other Agencies
8600,8656,OFFICE OF FEDERAL HOUSING ENTERPRISE OVERSIGHT,,,HUD,Other Agencies
8600,865A,"OFFICE OF REGIONAL ADMINISTRATOR, REGION 1",,,HUD,Other Agencies
8600,865B,"OFFICE OF REGIONAL ADMINISTRATOR, REGION 2",,,HUD,Other Agencies
8600,865C,"OFFICE OF REGIONAL ADMINISTRATOR, REGION 3",,,HUD,Other Agencies
8600,865D,"OFFICE OF REGIONAL ADMINISTRATOR, REGION 4",,,HUD,Other Agencies
8600,865E,"OFFICE OF REGIONAL ADMINISTRATOR, REGION 5",,,HUD,Other Agencies
8600,865F,"OFFICE OF REGIONAL ADMINISTRATOR, REGION 6",,,HUD,Other Agencies
8600,865G,"OFFICE OF REGIONAL ADMINISTRATOR, REGION 7",,,HUD,Other Agencies
8600,865H,"OFFICE OF REGIONAL ADMINISTRATOR, REGION 8",,,HUD,Other Agencies
8600,865J,"OFFICE OF REGIONAL ADMINISTRATOR, REGION 9",,,HUD,Other Agencies
8600,865K,"OFFICE OF REGIONAL ADMINISTRATOR, REGION 10",,,HUD,Other Agencies
8600,8681,FEDERAL NATIONAL MORTGAGE ASSOCIATION,,,HUD,Other Agencies
8800,8800,NATIONAL ARCHIVES AND RECORDS ADMINISTRATION,,,Archives,Other Agencies
8800,8861,NATIONAL ARCHIVES TRUST FUND BOARD,,,Archives,Other Agencies
8800,8862,NATIONAL HISTORICAL PUBLICATIONS AND RECORDS COMMISSION,,,Archives,Other Agencies
8900,8900,"ENERGY, DEPARTMENT OF",,,Energy,Energy
8900,8901,OFFICE OF THE SECRETARY,,,Energy,Energy
8900,8902,OFFICE OF THE DEPUTY SECRETARY,,,Energy,Energy
8900,8903,OFFICE OF THE GENERAL COUNSEL,,,Energy,Energy
8900,8904,OFFICE OF INSPECTOR GENERAL,,,Energy,Energy
8900,8905,OFFICE OF ADMINISTRATION AND HUMAN RESOURCES MANAGEMENT,,,Energy,Energy
8900,8907,ASSISTANT SECRETARY FOR CONGRESSIONAL AND INTERGOVERNMENTAL AFFAIRS,,,Energy,Energy
8900,8908,OFFICE OF PUBLIC AFFAIRS,,,Energy,Energy
8900,8909,ASSISTANT SECRETARY FOR DOMESTIC AND INTERNATIONAL ENERGY POLICY,,,Energy,Energy
8900,890A,OFFICE OF THE UNDER SECRETARY,,,Energy,Energy
8900,8910,OFFICE OF SPECIAL PROJECTS,,,Energy,Energy
8900,8911,OFFICE OF MINORITY ECONOMIC IMPACT,,,Energy,Energy
8900,8912,BOARD OF CONTRACT APPEALS,,,Energy,Energy
8900,8913,OFFICE OF HEARINGS AND APPEALS,,,Energy,Energy
8900,8914,OFFICE OF SCHEDULING AND LOGISTICS,,,Energy,Energy
8900,8915,OFFICE OF NUCLEAR SAFETY,,,Energy,Energy
8900,8916,"OFFICE OF PROCUREMENT, ASSISTANCE, AND PROGRAM MANAGEMENT",,,Energy,Energy
8900,8917,OFFICE OF INTELLIGENCE,,,Energy,Energy
8900,8918,OFFICE OF SMALL AND DISADVANTAGED BUSINESS UTILIZATION,,,Energy,Energy
8900,8919,OFFICE OF THE SECRETARY OF ENERGY ADVISORY BOARD,,,Energy,Energy
8900,891B,OFFICE OF SECURITY AFFAIRS,,,Energy,Energy
8900,891C,CHIEF FINANCIAL OFFICER,,,Energy,Energy
8900,891D,OFFICE OF EMERGENCY PLANNING AND OPERATIONS,,,Energy,Energy
8900,891E,OFFICE OF CONTRACTOR EMPLOYEE PROTECTION,,,Energy,Energy
8900,8921,OFFICE OF NEW PRODUCTION REACTORS,,,Energy,Energy
8900,8922,ASSISTANT SECRETARY FOR CONSERVATION AND RENEWABLE ENERGY,,,Energy,Energy
8900,8925,ASSISTANT SECRETARY FOR DEFENSE PROGRAMS,,,Energy,Energy
8900,8930,ECONOMIC REGULATORY ADMINISTRATION,,,Energy,Energy
8900,8933,ENERGY INFORMATION ADMINISTRATION,,,Energy,Energy
8900,8936,OFFICE OF ENERGY RESEARCH,,,Energy,Energy
8900,8938,OFFICE OF CIVILIAN RADIOACTIVE WASTE MANAGEMENT,,,Energy,Energy
8900,8940,"ASSISTANT SECRETARY FOR ENVIRONMENT, SAFETY AND HEALTH",,,Energy,Energy
8900,8941,ASSISTANT SECRETARY FOR ENVIRONMENTAL RESTORATION AND WASTE MANAGEMENT,,,Energy,Energy
8900,8944,ASSISTANT SECRETARY FOR FOSSIL ENERGY,,,Energy,Energy
8900,8948,ASSISTANT SECRETARY FOR NUCLEAR ENERGY,,,Energy,Energy
8900,8951,BARTLESVILLE PROJECT OFFICE,,,Energy,Energy
8900,8952,METAIRIE SITE OFFICE,,,Energy,Energy
8900,8953,SAVANNAH RIVER RESTART SPECIAL PROJECTS OFFICE,,,Energy,Energy
8900,8954,YUCCA MOUNTAIN PROJECT OFFICE,,,Energy,Energy
8900,8955,NATIONAL RENEWABLE ENERGY LABORATORY AREA OFFICE,,,Energy,Energy
8900,895A,"FIELD OFFICE, ALBUQUERQUE",,,Energy,Energy
8900,895B,BONNEVILLE POWER ADMINISTRATION,,,Energy,Energy
8900,895C,"FIELD OFFICE, CHICAGO",,,Energy,Energy
8900,895D,"FIELD OFFICE, IDAHO",,,Energy,Energy
8900,895E,"FIELD OFFICE, NEVADA",,,Energy,Energy
8900,895F,"FIELD OFFICE, OAK RIDGE",,,Energy,Energy
8900,895G,PITTSBURGH NAVAL REACTORS OFFICE,,,Energy,Energy
8900,895H,"FIELD OFFICE, RICHLAND",,,Energy,Energy
8900,895I,ROCKY FLATS PROJECT OFFICE,,,Energy,Energy
8900,895J,"FIELD OFFICE, SAN FRANCISCO",,,Energy,Energy
8900,895K,SCHENECTADY NAVAL REACTORS OFFICE,,,Energy,Energy
8900,895L,OFFICE OF SCIENTIFIC AND TECHNICAL INFORMATION,,,Energy,Energy
8900,895M,SOUTHWESTERN POWER ADMINISTRATION,,,Energy,Energy
8900,895N,"FIELD OFFICE, SAVANNAH RIVER",,,Energy,Energy
8900,895P,SOUTHEASTERN POWER ADMINISTRATION,,,Energy,Energy
8900,895Q,SUPERCONDUCTING SUPER COLLIDER PROJECT OFFICE,,,Energy,Energy
8900,895R,WESTERN AREA POWER ADMINISTRATION,,,Energy,Energy
8900,895S,ALASKA POWER ADMINISTRATION,,,Energy,Energy
8900,895T,"FIELD OFFICE, FERNALD",,,Energy,Energy
8900,895U,MORGANTOWN ENERGY TECHNOLOGY CENTER,,,Energy,Energy
8900,895V,"NAVAL PETROLEUM AND OIL SHALE RESERVES IN CO, UT AND WY",,,Energy,Energy
8900,895W,NAVAL PETROLEUM RESERVES IN CALIFORNIA,,,Energy,Energy
8900,895X,PITTSBURGH ENERGY TECHNOLOGY CENTER,,,Energy,Energy
8900,895Y,ECONOMIC REGULATORY ADMINISTRATION FIELD OFFICES,,,Energy,Energy
8900,895Z,STRATEGIC PETROLEUM RESERVES PROJECT OFFICE,,,Energy,Energy
8961,8961,FEDERAL ENERGY REGULATORY COMMISSION,,,Energy,Energy
9000,9000,SELECTIVE SERVICE SYSTEM,,,SELECTIVE SERVICE SYSTEM,Other Agencies
901,901,COMMISSION ON SECURITY AND COOPERATION IN EUROPE,,,All other Customers,Other Agencies
902,902,BOTANIC GARDEN,,,All other Customers,Other Agencies
903,903,COPYRIGHT ROYALTY TRIBUNAL,,,All other Customers,Other Agencies
907,907,OFFICE OF TECHNOLOGY ASSESSMENT,,,All other Customers,Other Agencies
908,908,RAILROAD ACCOUNTING PRINCIPLES BOARD,,,All other Customers,Other Agencies
910,910,BIOMEDICAL ETHICS BOARD,,,All other Customers,Other Agencies
9100,9100,"EDUCATION, DEPARTMENT OF",,,Education,Other Agencies
9100,9101,IMMEDIATE OFFICE OF THE SECRETARY OF EDUCATION,,,Education,Other Agencies
9100,9102,OFFICE OF THE UNDER SECRETARY OF EDUCATION,,,Education,Other Agencies
9100,9103,OFFICE OF THE GENERAL COUNSEL,,,Education,Other Agencies
9100,9104,OFFICE OF INSPECTOR GENERAL,,,Education,Other Agencies
9100,9105,OFFICE OF HUMAN RESOURCES AND ADMINISTRATION,,,Education,Other Agencies
9100,9106,OFFICE OF MANAGEMENT AND BUDGET/CHIEF FINANCIAL OFFICER,,,Education,Other Agencies
9100,9107,OFFICE OF LEGISLATION,,,Education,Other Agencies
9100,9108,OFFICE OF POLICY AND PLANNING,,,Education,Other Agencies
9100,9109,OFFICE OF INTERGOVERNMENTAL AND INTERAGENCY AFFAIRS,,,Education,Other Agencies
911,911,COMMISSION ON AGRICULTURAL WORKERS,,,All other Customers,Other Agencies
9100,9111,OFFICE FOR CIVIL RIGHTS,,,Education,Other Agencies
912,912,COMMISSION ON INTERSTATE CHILD SUPPORT,,,All other Customers,Other Agencies
9100,9120,OFFICE OF VOCATIONAL AND ADULT EDUCATION,,,Education,Other Agencies
9100,9121,OFFICE OF BILINGUAL EDUCATION AND MINORITY LANGUAGES AFFAIRS,,,Education,Other Agencies
9100,9124,OFFICE OF SPECIAL EDUCATION AND REHABILITATIVE SERVICES,,,Education,Other Agencies
9100,9125,NATIONAL INSTITUTE ON DISABILITY AND REHABILITATION RESEARCH,,,Education,Other Agencies
9100,9126,REHABILITATIVE SERVICES ADMINISTRATION,,,Education,Other Agencies
9100,9127,OFFICE OF SPECIAL EDUCATION PROGRAMS,,,Education,Other Agencies
9100,9128,IMMED OFF OF THE ASST SEC FOR SPECIAL EDUC AND REHAB SERVICES,,,Education,Other Agencies
9100,9129,FUND FOR THE IMPROVEMENT OF POSTSECONDARY EDUCATION,,,Education,Other Agencies
913,913,NATIONAL COMMISSION ON ACQUIRED IMMUNE DEFICIENCY SYNDROME,,,All other Customers,Other Agencies
9100,9130,IMMED OFF OF THE ASST SEC FOR POSTSECONDARY EDUCATION,,,Education,Other Agencies
9100,9131,STUDENT FINANCIAL ASSISTANCE PROGRAMS,,,Education,Other Agencies
9100,9132,IMMEDIATE OFF OF THE ASST SEC FOR EDUCATIONAL RESEARCH AND IMPROVEMENT,,,Education,Other Agencies
9100,9133,OFFICE OF HIGHER EDUCATION PROGRAMS,,,Education,Other Agencies
9100,9134,OFFICE OF POSTSECONDARY EDUCATION,,,Education,Other Agencies
9100,9135,LIBRARIES AND LEARNING TECHNOLOGIES PROGRAMS,,,Education,Other Agencies
9100,9136,NATIONAL INSTITUTE OF EDUCATION,,,Education,Other Agencies
9100,9137,EDUCATION PROFESSIONAL DEVELOPMENT AND DISSEMINATION PROGRAMS,,,Education,Other Agencies
9100,9138,NATIONAL CENTER FOR EDUCATION STATISTICS,,,Education,Other Agencies
9100,9139,OFFICE OF EDUCATIONAL RESEARCH AND IMPROVEMENT,,,Education,Other Agencies
914,914,JOHN C. STENNIS CENTER FOR PUBLIC DEVELOPMENT,,,All other Customers,Other Agencies
9100,9140,COMPENSATORY EDUCATION PROGRAMS,,,Education,Other Agencies
9100,9141,IMMED OFF OF THE ASST SEC FOR ELEMENTARY AND SECONDARY EDUC,,,Education,Other Agencies
9100,9142,MIGRANT EDUCATION PROGRAMS,,,Education,Other Agencies
9100,9144,STATE AND LOCAL EDUCATION PROGRAMS,,,Education,Other Agencies
9100,9145,INDIAN EDUCATION PROGRAMS,,,Education,Other Agencies
9100,9146,OFFICE OF ELEMENTARY AND SECONDARY EDUCATION,,,Education,Other Agencies
9100,916A,ADVISORY COUNCILS AND COMMITTEES,,,Education,Other Agencies
9100,9181,STUDENT LOAN MARKETING ASSOCIATION,,,Education,Other Agencies
9100,9191,AMERICAN PRINTING HOUSE FOR THE BLIND,,,Education,Other Agencies
9100,9192,GALLAUDET COLLEGE,,,Education,Other Agencies
9100,9193,HOWARD UNIVERSITY,,,Education,Other Agencies
9100,9194,NATIONAL TECHNICAL INSTITUTE FOR THE DEAF,,,Education,Other Agencies
9300,9300,FEDERAL MEDIATION AND CONCILIATION SERVICE,,,All other Customers,Other Agencies
9400,9400,UNITED STATES ARMS CONTROL AND DISARMAMENT AGENCY,,,All other Customers,Other Agencies
9502,9502,NATIONAL CAPITAL PLANNING COMMISSION,,,NATIONAL CAPITAL PLANNING COMMISSION,Other Agencies
9503,9503,PROSPECTIVE PAYMENT ASSESSMENT COMMISSION,,,All other Customers,Other Agencies
9504,9504,FEDERAL MINE SAFETY AND HEALTH REVIEW COMMISSION,,,All other Customers,Other Agencies
9506,9506,FEDERAL ELECTION COMMISSION,,,FEDERAL ELECTION COMMISSION,Other Agencies
9507,9507,COMMODITY FUTURES TRADING COMMISSION,,,COMMODITY FUTURES TRADING COMMISSION,Other Agencies
9508,9508,NATIONAL TRANSPORTATION SAFETY BOARD,,,NATIONAL TRANSPORTATION SAFETY BOARD,Other Agencies
9509,9509,NATIONAL COUNCIL ON THE HANDICAPPED,,,All other Customers,Other Agencies
9510,9510,HARRY S TRUMAN SCHOLARSHIP FOUNDATION,,,All other Customers,Other Agencies
9512,9512,JAPAN-U.S. FRIENDSHIP COMMISSION,,,All other Customers,Other Agencies
9513,9513,MARINE MAMMAL COMMISSION,,,All other Customers,Other Agencies
9514,9514,OCCUPATIONAL SAFETY AND HEALTH REVIEW COMMISSION,,,OCCUPATIONAL SAFETY AND HEALTH REVIEW COMMISSION,Other Agencies
9516,9516,DEFENSE NUCLEAR FACILITIES SAFETY BOARD,,,DEFENSE NUCLEAR FACILITIES SAFETY BOARD,Other Agencies
9517,9517,COMMISSION ON CIVIL RIGHTS,,,COMMISSION ON CIVIL RIGHTS,Other Agencies
9518,9518,COMMITTEE FOR PURCHASE FROM PEOPLE WHO ARE BLIND OR SEVERELY DISABLED,,,COMMITTEE FOR PURCHASE FROM PEOPLE WHO ARE BLIND O,Other Agencies
9519,9519,INTELLIGENCE COMMUNITY STAFF,,,All other Customers,Other Agencies
9520,9520,PHYSICIANS PAYMENT REVIEW COMMISSION,,,All other Customers,Other Agencies
9521,9521,PANAMA CANAL COMMISSION,,,All other Customers,Other Agencies
9523,9523,ELECTION ASSISTANCE COMMISSION,,,ELECTION ASSISTANCE COMMISSION,Other Agencies
9524,9524,NATIONAL MEDIATION BOARD,,,NATIONAL MEDIATION BOARD,Other Agencies
9527,9527,NATIONAL COMMISSION ON LIBRARIES AND INFORMATION SCIENCE,,,All other Customers,Other Agencies
9530,9530,ADVISORY COUNCIL ON HISTORIC PRESERVATION,,,All other Customers,Other Agencies
9531,9531,UNITED STATES HOLOCAUST MEMORIAL MUSEUM,,,All other Customers,Other Agencies
9532,9532,ARCHITECTURAL AND TRANSPORTATION BARRIERS COMPLIANCE BOARD,,,All other Customers,Other Agencies
9537,9537,COMMISSION OF FINE ARTS,,,All other Customers,Other Agencies
9540,9540,FEDERAL HOUSING FINANCE BOARD,,,FEDERAL HOUSING FINANCE BOARD,Other Agencies
9541,9541,JAMES MADISON MEMORIAL FELLOWSHIP COMMISSION,,,All other Customers,Other Agencies
9542,9542,FEDERAL HOUSING FINANCE AGENCY,,,FEDERAL HOUSING FINANCE AGENCY,Other Agencies
9543,9543,MILLENIUM CHALLENGE CORPORATION,,,MILLENIUM CHALLENGE CORPORATION,Other Agencies
9545,9545,MORRIS K. UDALL SCHOLARSHIP AND EXCELLENCE IN NATIONAL ENVIRONMENTAL POLICY FOUNDATION,,,All other Customers,Other Agencies
9547,9547,NATIONAL COMMISSION ON MIGRANT EDUCATION,,,All other Customers,Other Agencies
9549,9549,OFFICE OF GOVERNMENT ETHICS,,,All other Customers,Other Agencies
9559,9559,"FEDERAL RESERVE SYSTEM, BOARD OF GOVERNORS",,,All other Customers,Other Agencies
9559,955F,CONSUMER FINANCIAL PROTECTION BUREAU,,,All other Customers,Other Agencies
9560,9560,BARRY GOLDWATER SCHOLARSHIP AND EXCELLENCE IN EDUCATION FUND,,,All other Customers,Other Agencies
9561,9561,RECOVERY ACCOUNTABILITY AND TRANSPARENCY BOARD,,,All other Customers,Other Agencies
9562,9562,FEDERAL FINANCIAL INSTITUTIONS EXAMINATION COUNCIL,,,All other Customers,Other Agencies
9565,9565,CHEMICAL SAFETY AND HAZARD INVESTIGATION BOARD,,,All other Customers,Other Agencies
9568,9568,BROADCASTING BOARD OF GOVERNORS,,,BROADCASTING BOARD OF GOVERNORS,Other Agencies
9570,9570,PRESCRIPTION DRUG PAYMENT REVIEW COMMISSION,,,All other Customers,Other Agencies
955F,9572,DENALI COMMISSION,,,All other Customers,Other Agencies
9577,9577,CORPORATION FOR NATIONAL AND COMMUNITY SERVICE,,,CORPORATION FOR NATIONAL AND COMMUNITY SERVICE,Other Agencies
9580,9580,UNITED STATES INSTITUTE OF PEACE,,,All other Customers,Other Agencies
9581,9581,COMMISSION ON NATIONAL AND COMMUNITY SERVICE,,,All other Customers,Other Agencies
9582,9582,COMPETITIVENESS PAY COUNCIL,,,All other Customers,Other Agencies
9583,9583,"NATIONAL COMM ON AMERICAN INDIAN, ALASKA NATIVE, NATIVE HAWAIIAN HOUSING",,,All other Customers,Other Agencies
9584,9584,NATIONAL COMMISSION ON SEVERELY DISTRESS PUBLIC HOUSING,,,All other Customers,Other Agencies
9591,9591,"RFE/RL, INC.",,,All other Customers,Other Agencies
9593,9593,U.S. COURT OF VETERAN APPEALS,,,All other Customers,Other Agencies
9594,9594,COURT SERVICES AND OFFENDER SUPERVISION AGENCY,,,COURT SERVICES AND OFFENDER SUPERVISION AGENCY,Other Agencies
9594,959P,PRETRIAL SERVICES AGENCY,,,COURT SERVICES AND OFFENDER SUPERVISION AGENCY,Other Agencies
9540,95HL,FEDERAL HOME LOAN BANKS,,,All other Customers,Other Agencies
9668,9668,MISSISSIPPI RIVER COMMISSION,,,All other Customers,Other Agencies
9700,96CE,U.S. ARMY CORPS OF ENGINEERS - CIVIL PROGRAM FINANCING ONLY,,,Other DoD,Defense
9700,9700,DEPT OF DEFENSE,,,Other DoD,Defense
9700,9748,DEFENSE HUMAN RESOURCES ACTIVITY,DEFENSE HUMAN RESOURCE ACTIVITY,Other DoD,Other DoD,Defense
9700,9760,TRICARE MANAGEMENT ACTIVITY (TMA),TRICARE MANAGEMENT ACTIVITY (TMA),Other DoD,Other DoD,Defense
9700,9761,DEFENSE THREAT REDUCTION AGENCY (DTRA),DEFENSE THREAT REDUCTION AGENCY,Other DoD,Other DoD,Defense
9700,9763,DEFENSE CONTRACT MANAGEMENT AGENCY (DCMA),DEFENSE CONTRACT MANAGEMENT AGENCY,Other DoD,Other DoD,Defense
9700,9770,AFRRI,AFRRI,Other DoD,Other DoD,Defense
9700,9771,DEFENSE MICROELECTRONICS ACTIVITY (DMEA),DEFENSE MICROELECTRONICS ACTIVITY,Other DoD,Other DoD,Defense
9700,9773,VIRGINIA CONTRACTING AGENCY,VIRGINIA CONTRACTING AGENCY,Other DoD,Other DoD,Defense
9700,9776,USTRANSCOM,U.S. TRANSPORTATION COMMAND (TRANSCOM),Other DoD,Other DoD,Defense
9700,9777,BUSINESS TRANSFORMATION AGENCY,BUSINESS TRANSFORMATION AGENCY (BTA),Other DoD,Other DoD,Defense
9700,97AB,NATIONAL GEOSPATIAL-INTELLIGENCE AGENCY (NGA),,,Other DoD,Defense
9700,97AD,IMMEDIATE OFFICE OF THE SECRETARY OF DEFENSE,,,Other DoD,Defense
9700,97AE,DEFENSE ADVANCED RESEARCH PROJECTS AGENCY (DARPA),DEFENSE ADVANCED RESEARCH PROJECTS AGENCY,Other DoD,Other DoD,Defense
9700,97AH,Defense Nuclear Agency,,,Other DoD,Defense
9700,97AK,DEFENSE INFORMATION SYSTEMS AGENCY (DISA),DEFENSE INFORMATION SYSTEMS AGENCY,Other DoD,Other DoD,Defense
9700,97AR,DEFENSE CONTRACT AUDIT AGENCY,,,Other DoD,Defense
9700,97AS,DEFENSE LOGISTICS AGENCY,DEFENSE LOGISTICS AGENCY,Other DoD,Other DoD,Defense
9700,97AT,DEFENSE SECURITY COOPERATION AGENCY,DEFENSE SECURITY COOPERATION AGENCY,Other DoD,Other DoD,Defense
9700,97AV,DEFENSE SECURITY SERVICE,DEFENSE SECURITY SERVICE (DSS),Other DoD,Other DoD,Defense
9700,97AW,ON SITE INSPECTION AGENCY,,,Other DoD,Defense
9700,97AZ,DEFENSE COMMISSARY AGENCY (DECA),DEFENSE COMMISSARY AGENCY (DECA),Other DoD,Other DoD,Defense
9700,97BZ,DEFENSE FINANCE AND ACCOUNTING SERVICE (DFAS),DEFENSE FINANCE AND ACCOUNTING SERVICE,Other DoD,Other DoD,Defense
9700,97F1,DEFENSE MEDIA CENTER (DMC),DEFENSE MEDIA ACTIVITY,Other DoD,Other DoD,Defense
9700,97F2,DEPT OF DEFENSE EDUCATION ACTIVITY (DODEA),DEPT OF DEFENSE EDUCATION ACTIVITY,Other DoD,Other DoD,Defense
9700,97F3,"Civilian Health and Medical Program of the Uniformed Services, Office of the",,,Other DoD,Defense
9700,97F5,WASHINGTON HEADQUARTERS SERVICES (WHS),WASHINGTON HEADQUARTERS SERVICES,Other DoD,Other DoD,Defense
9700,97F7,JOINT IMPROVISED EXPLOSIVE DEVICE DEFEAT ORGANIZATION (JIEDDO),,Other DoD,Other DoD,Defense
9700,97HW,UNIFORMED SERVICES UNIVERSITY OF THE HEALTH SCIENCES (USUHS),UNIFORMED SERVICES U OF THE HEALTH SCIENCES (USUHS),Other DoD,Other DoD,Defense
9700,97JC,MISSILE DEFENSE AGENCY (MDA),MISSILE DEFENSE AGENCY,Other DoD,Other DoD,Defense
9700,97ZS,U.S. SPECIAL OPERATIONS COMMAND (USSOCOM),U.S. SPECIAL OPERATIONS COMMAND (SOCOM),Other DoD,Other DoD,Defense
1200,9999,FEDERAL CROP INSURANCE CORPORATION,,,Agriculture,Other Agencies
AFRH,AFRH,ARMED FORCES RETIREMENT HOME,,,ERROR,ERROR
,,Blank,,,,
