"ReasonsForVariationsFromApprovedISDfactor","Variation","Factor","Explanation","Unit","Platform","Source"
"Historic","***","Procurement Processes (International Collaboration)","A change due to programme rebalancing","Months","A400M","2013"
"Historic","***","Technical Factors","Updated programme estimate based upon A400M Task Force outputs and Air Support Cluster assessment","Months","A400M","2013"
"Historic","***","Technical Factors","Updated programme proposal received from Airbus Military, including revised production approach","Months","A400M","2013"
"Historic","***","Technical Factors","Programme delays affecting engine and aircraft first flight","Months","A400M","2013"
"Historic","***","Technical Factors","Reflects latestet delay and risk assessment beyond first flight","Months","A400M","2013"
"Historic","9","Technical Factors","Contract delay to aircraft delivery","Months","A400M","2013"
"Historic","16","Budgetary Factors","Change in the customers' requirement flowing from changed budgetary priorities","Months","A400M","2013"
"Historic","9","Procurement Processes","Delay in brining contract into effect as a result of delayed approvals in Germany","Months","A400M","2013"
"Net Variation","73",NA,NA,"Months","A400M","2013"
