"Description","Year1","Year2","Year3","Year4","FirstYearInSequence","Platform","Source","Agency","BudgetActivity"
"System Development and Demonstration","1-3Q",NA,NA,NA,"2003","LW155 M777","1905-06-26","Army","RDT&E Budget Activity  5 - Engineering and Manufacturing Development"
"Design Verification and Test / Technical Testing","2-4Q","1-3Q",NA,NA,"2003","LW155 M777","1905-06-26","Army","RDT&E Budget Activity  5 - Engineering and Manufacturing Development"
"Artic Operational Test and Evaluation (M777E1)",NA,"2Q",NA,NA,"2003","LW155 M777","1905-06-26","Army","RDT&E Budget Activity  5 - Engineering and Manufacturing Development"
"Joint Operational Test and Evaluation (M777E1)",NA,"4Q",NA,NA,"2003","LW155 M777","1905-06-26","Army","RDT&E Budget Activity  5 - Engineering and Manufacturing Development"
"Milestone C",NA,NA,"1Q",NA,"2003","LW155 M777","1905-06-26","Army","RDT&E Budget Activity  5 - Engineering and Manufacturing Development"
"Full Rate Production Decision",NA,NA,"1Q",NA,"2003","LW155 M777","1905-06-26","Army","RDT&E Budget Activity  5 - Engineering and Manufacturing Development"
"Initial Operational Capability",NA,NA,NA,"4Q","2003","LW155 M777","1905-06-26","Army","RDT&E Budget Activity  5 - Engineering and Manufacturing Development"
